{
  "contract_version": "1",
  "host_id": "ehost-56475aa75463474c0285",
  "host_public_key": "A6EHv_POEL4dcN0Y50vAmWfk1jCbpQ1fHdyGZBJVMbg",
  "host_public_key_fingerprint": "sha256:Vkdap1RjR0wChd9dvyvKtz2mUTWIOem3dIGy6rEHcIw",
  "ble_service_uuid": "179e2e95-b1ee-5aa5-8dcf-7519b6c7ac52",
  "mode": "development",
  "commissioning_id": "123e4567-e89b-42d3-a456-426614174000",
  "commissioning_secret": "test-commissioning-secret-0123456789abcdef",
  "issued_at": "2026-08-05T00:00:00Z",
  "expires_at": "2026-08-05T00:30:00Z",
  "signature": "aP5woSr_r_Tv5H9RZmdS4dgJe3g-G6Tz2BWpDBC_8grBbA0kQ_u4CFoIFEPqZsQ8EXlQNGd5Tof-t915gwqtBQ"
}
